{
  "schema_version": "1.0",
  "module": "subtitles",
  "status": "curated",
  "last_verified": "2026-06-05",
  "events": [
    {
      "name": "texttrackchange",
      "when": "Usuario cambia la pista de subtítulos activa",
      "payload_shape": { "track": "TextTrack | null" },
      "optional": true
    },
    {
      "name": "texttrackaddtrack",
      "when": "Nueva pista de texto disponible en el stream",
      "payload_shape": { "track": "TextTrack" },
      "optional": true
    }
  ],
  "api_contracts": [
    {
      "method": "player.textTracks",
      "expected_behavior": "Lista de TextTrack disponibles. Cada uno tiene kind, label, language, mode ('disabled'|'showing'|'hidden').",
      "side_effects": []
    },
    {
      "method": "textTrack.mode = 'showing'",
      "expected_behavior": "Habilita los subtítulos para esa pista. La pista anterior pasa a mode='disabled'.",
      "side_effects": ["emite texttrackchange"]
    }
  ],
  "acceptance_criteria": [
    {
      "id": "AC-SUBTITLES-001",
      "scenario": "Subtítulos WebVTT se muestran correctamente",
      "given": "Player con VOD que tiene pista WebVTT configurada",
      "when": "El usuario habilita los subtítulos (textTrack.mode = 'showing')",
      "then": "Los subtítulos aparecen en pantalla sincronizados con el audio. texttrackchange se emite.",
      "priority": "MUST",
      "covered_by": ["tests/a11y/"]
    },
    {
      "id": "AC-SUBTITLES-002",
      "scenario": "WCAG 1.2.2 — subtítulos disponibles para contenido pregrabado",
      "given": "Player con VOD que tiene audio",
      "when": "Se audita con axe-core",
      "then": "No hay violaciones de WCAG 1.2.2 (Captions prerecorded).",
      "priority": "MUST",
      "covered_by": ["tests/a11y/"]
    },
    {
      "id": "AC-SUBTITLES-003",
      "scenario": "Cambio de pista de subtítulos",
      "given": "Player con múltiples pistas de subtítulos (ej: Español, Inglés)",
      "when": "El usuario cambia de pista",
      "then": "La pista anterior se deshabilita (mode='disabled'). La nueva pista se muestra (mode='showing'). texttrackchange se emite.",
      "priority": "SHOULD",
      "covered_by": []
    }
  ],
  "known_bugs": [],
  "do_not_reflag": [],
  "test_anti_patterns": [
    "No verificar posición de subtítulos en pantalla con coordenadas de pixel — usar a11y",
    "CEA-608/708 solo disponible con hls.js full (no hls-light)"
  ]
}
