{
  "schema_version": "1.0",
  "module": "plugins",
  "status": "curated",
  "last_verified": "2026-06-05",
  "events": [],
  "api_contracts": [
    {
      "method": "loadPlugins(options)",
      "expected_behavior": "Carga los plugins relevantes para la config dada. Los plugins se cargan lazy (import()). El orden de inicialización es determinístico.",
      "side_effects": [
        "Plugins montados como componentes React"
      ],
      "error_behavior": "Si un plugin falla → ese plugin no se monta. Los demás plugins no se ven afectados."
    }
  ],
  "acceptance_criteria": [
    {
      "id": "AC-PLUGINS-001",
      "scenario": "Plugin no disponible no rompe otros plugins",
      "given": "Plugin de analytics CDN no disponible",
      "when": "El player intenta cargar los plugins",
      "then": "El plugin fallido se omite. Los otros plugins (ads, DRM, etc.) se cargan correctamente.",
      "priority": "MUST",
      "covered_by": []
    },
    {
      "id": "AC-PLUGINS-002",
      "scenario": "Smoke test: player carga con todos los plugins standard",
      "given": "Config con analytics + ads habilitados",
      "when": "El player inicializa",
      "then": "El evento 'ready' se emite. Todos los plugins configurados están activos.",
      "priority": "SHOULD",
      "covered_by": []
    }
  ],
  "known_bugs": [],
  "do_not_reflag": [],
  "test_anti_patterns": [
    "No mockear plugins en tests de integración — testear comportamiento observable"
  ]
}
