{
  "schema_version": "1.0",
  "module": "ads-ima",
  "status": "curated",
  "last_verified": "2026-06-05",
  "events": [
    {
      "name": "adsLoaded",
      "when": "IMA SDK carga y parsea la respuesta VAST",
      "payload_shape": { "totalAds": "number" },
      "must_precede": ["adsStarted"]
    },
    {
      "name": "adsRequested",
      "when": "Solicitud VAST enviada al endpoint",
      "payload_shape": {},
      "must_precede": ["adsLoaded"]
    },
    {
      "name": "adsContentPauseRequested",
      "when": "IMA solicita pausar el content para reproducir el ad",
      "payload_shape": {},
      "must_follow": ["adsLoaded"],
      "must_precede": ["adsStarted"]
    },
    {
      "name": "adsStarted",
      "when": "Primer frame del ad renderizado en el ad container",
      "payload_shape": { "duration": "number", "skipOffset": "number | null" },
      "must_follow": ["adsContentPauseRequested"]
    },
    {
      "name": "adsImpression",
      "when": "Beacon de impresión enviado (coincide con adsStarted aprox.)",
      "payload_shape": {},
      "must_follow": ["adsStarted"]
    },
    {
      "name": "adsFirstQuartile",
      "when": "currentTime del ad >= duration * 0.25",
      "payload_shape": {},
      "must_follow": ["adsStarted"]
    },
    {
      "name": "adsMidpoint",
      "when": "currentTime del ad >= duration * 0.50",
      "payload_shape": {},
      "must_follow": ["adsFirstQuartile"]
    },
    {
      "name": "adsThirdQuartile",
      "when": "currentTime del ad >= duration * 0.75",
      "payload_shape": {},
      "must_follow": ["adsMidpoint"]
    },
    {
      "name": "adsComplete",
      "when": "Ad llegó al final (currentTime === duration)",
      "payload_shape": {},
      "must_follow": ["adsThirdQuartile"]
    },
    {
      "name": "adsAllAdsCompleted",
      "when": "Todos los ads del ad break completaron",
      "payload_shape": {},
      "must_follow": ["adsComplete"]
    },
    {
      "name": "adsContentResumeRequested",
      "when": "IMA solicita reanudar el content después del ad break",
      "payload_shape": {},
      "must_follow": ["adsAllAdsCompleted"]
    },
    {
      "name": "adsError",
      "when": "IMA SDK reporta error (VAST vacío, CDN falla, etc.)",
      "payload_shape": { "code": "number", "type": "string" },
      "optional": true
    },
    {
      "name": "adsSkipped",
      "when": "Usuario activa skip button después del skipOffset",
      "payload_shape": {},
      "optional": true
    },
    {
      "name": "adsPaused",
      "when": "Ad pausado por el usuario o por el sistema",
      "payload_shape": {},
      "optional": true
    },
    {
      "name": "adsResumed",
      "when": "Ad reanudado después de pausa",
      "payload_shape": {},
      "optional": true
    }
  ],
  "api_contracts": [
    {
      "method": "adsManager.play()",
      "expected_behavior": "Inicia la reproducción del ad. Si hay un ad activo retorna truthy para que Controls no llame playerHandler.play(). Retorna false o undefined si no hay ad.",
      "side_effects": ["emite adsStarted si es primer frame", "content pausado durante ad"]
    },
    {
      "method": "adsManager.pause()",
      "expected_behavior": "Pausa el ad activo. Retorna truthy para que Controls no llame playerHandler.pause().",
      "side_effects": ["emite adsPaused"]
    },
    {
      "method": "adsManager.adInfo",
      "expected_behavior": "Retorna objeto con información del ad activo: { isLinear, duration, skipOffset, adId }. null si no hay ad activo.",
      "side_effects": []
    }
  ],
  "acceptance_criteria": [
    {
      "id": "AC-IMA-001",
      "scenario": "Pre-roll VAST básico — secuencia completa de eventos en orden",
      "given": "Player con ads.map apuntando a VAST válido con un pre-roll de 15s",
      "when": "Se inicia la reproducción",
      "then": "Los eventos se emiten en este orden exacto: adsRequested → adsLoaded → adsContentPauseRequested → adsStarted → adsFirstQuartile → adsMidpoint → adsThirdQuartile → adsComplete → adsAllAdsCompleted → adsContentResumeRequested. Content reanuda después.",
      "priority": "MUST",
      "covered_by": ["tests/e2e/ads-ima-tag-params.spec.ts"]
    },
    {
      "id": "AC-IMA-002",
      "scenario": "VAST vacío → adsError, content continúa",
      "given": "Player con ads.map apuntando a VAST que retorna 0 ads",
      "when": "El player intenta cargar ads",
      "then": "Se emite adsError o adsAllAdsCompleted inmediato. Content continúa reproduciéndose sin interrupciones.",
      "priority": "MUST",
      "covered_by": ["tests/integration/ads-ima-error.spec.ts"]
    },
    {
      "id": "AC-IMA-003",
      "scenario": "IMA SDK CDN falla → content continúa sin ads",
      "given": "CDN de IMA SDK no disponible (simular con page.route a 404)",
      "when": "El player intenta cargar el SDK",
      "then": "El player no crashea. Content reproduce normalmente sin ads. No se emite 'error' fatal.",
      "priority": "MUST",
      "covered_by": ["tests/integration/ads-ima-error.spec.ts"]
    },
    {
      "id": "AC-IMA-004",
      "scenario": "Beacons OMID se disparan exactamente una vez",
      "given": "Player con pre-roll válido",
      "when": "El ad se reproduce completo",
      "then": "Los beacons impression, firstQuartile, midpoint, thirdQuartile, complete se disparan exactamente una vez cada uno. Verificar con page.route() interceptando el tracking endpoint.",
      "priority": "MUST",
      "covered_by": ["tests/integration/ads-ima-error.spec.ts"]
    },
    {
      "id": "AC-IMA-005",
      "scenario": "Ad muted por autoplay policy",
      "given": "Player con autoplay:true en navegador con restrictive autoplay policy",
      "when": "El ad arranca automáticamente",
      "then": "El ad arranca muted. Se emite adsVolumeMuted o adsVolumeChanged con volume=0.",
      "priority": "SHOULD",
      "covered_by": []
    },
    {
      "id": "AC-IMA-006",
      "scenario": "VMAP con mid-roll",
      "given": "Player con ads.map apuntando a VMAP con mid-roll en t=00:00:30",
      "when": "El content llega a los 30 segundos",
      "then": "La reproducción se pausa. Se emite el ciclo completo de IMA lifecycle. Content reanuda en la posición correcta.",
      "priority": "SHOULD",
      "covered_by": []
    },
    {
      "id": "AC-IMA-007",
      "scenario": "Skip ad",
      "given": "Pre-roll con skipOffset configurado (ej: 5s)",
      "when": "Han pasado 5s de ad y el usuario activa skip",
      "then": "Se emite adsSkipped. Content reanuda desde la posición donde estaba antes del ad.",
      "priority": "SHOULD",
      "covered_by": []
    }
  ],
  "known_bugs": [
    {
      "id": "BUG-IMA-001",
      "title": "adsComplete no se emite en ads de menos de 3 segundos",
      "status": "open",
      "expected": "adsComplete se emite cuando currentTime del ad >= duration",
      "observed": "En ads muy cortos (<3s) el IMA SDK omite el evento COMPLETE. adsAllAdsCompleted y adsContentResumeRequested también se omiten."
    }
  ],
  "do_not_reflag": ["BUG-IMA-001"],
  "test_anti_patterns": [
    "No usar ads reales de producción en tests — usar mock-vast/server.ts",
    "No testear con VAST endpoints externos en CI — siempre usar fixtures locales",
    "No registrar page.route() después de goto() — debe ser antes"
  ]
}
