{
  "schema_version": "1.0",
  "module": "ads-adswizz",
  "status": "template",
  "last_verified": "2026-06-05",
  "events": [
    {
      "name": "adsStarted",
      "when": "Ad audio de AdSwizz comienza",
      "payload_shape": {},
      "optional": true
    },
    {
      "name": "adsComplete",
      "when": "Ad audio de AdSwizz termina",
      "payload_shape": {},
      "optional": true
    },
    {
      "name": "adsError",
      "when": "Error en sistema AdSwizz",
      "payload_shape": {},
      "optional": true
    }
  ],
  "api_contracts": [],
  "acceptance_criteria": [
    {
      "id": "AC-ADSWIZZ-001",
      "scenario": "SDK no disponible → content continúa",
      "given": "CDN de AdSwizz SDK no disponible",
      "when": "El player inicializa con AdSwizz configurado",
      "then": "Content de audio reproduce normalmente sin ads. No hay error fatal.",
      "priority": "MUST",
      "covered_by": []
    }
  ],
  "known_bugs": [],
  "do_not_reflag": [],
  "test_anti_patterns": []
}
