{
  "schema_version": "1.0",
  "module": "ads-manager",
  "status": "curated",
  "last_verified": "2026-06-05",
  "events": [
    {
      "name": "adsRequested",
      "when": "Solicitud VAST enviada al endpoint configurado en ads.map",
      "payload_shape": {},
      "must_precede": ["adsLoaded"]
    },
    {
      "name": "adsLoaded",
      "when": "VAST parseado exitosamente. Ads disponibles para reproducir.",
      "payload_shape": { "totalAds": "number" },
      "must_follow": ["adsRequested"]
    },
    {
      "name": "adsError",
      "when": "Error en la carga o parseo del VAST, o en la inicialización del ad system",
      "payload_shape": { "code": "number", "message": "string" },
      "optional": true
    }
  ],
  "api_contracts": [
    {
      "method": "adsManager.play()",
      "signature": "play(): Promise<boolean|undefined>",
      "expected_behavior": "Inicia ads si hay un ad break pendiente. Retorna truthy para señalizar a Controls que no llame playerHandler.play(). Retorna false/undefined si no hay ads.",
      "side_effects": ["Ad break iniciado", "content pausado"],
      "error_behavior": "Si ad system falla → content reproduce normalmente, retorna false."
    },
    {
      "method": "adsManager.pause()",
      "signature": "pause(): Promise<boolean|undefined>",
      "expected_behavior": "Pausa el ad activo. Retorna truthy para que Controls no pause el content.",
      "side_effects": ["Ad pausado"],
      "error_behavior": "No-op si no hay ad activo. Retorna false."
    },
    {
      "method": "adsManager.get(prop)",
      "signature": "get(prop: string): any",
      "expected_behavior": "Retorna la propiedad del ad activo (currentTime, paused, etc.). Retorna null si no hay ad activo, para que Controls delegate al playerHandler.",
      "side_effects": []
    },
    {
      "method": "adsManager.reset()",
      "signature": "reset(): void",
      "expected_behavior": "Resetea el estado de ads. Llamado cuando se carga nuevo content (src cambia).",
      "side_effects": ["Estado de ads limpiado", "cue points eliminados"]
    }
  ],
  "acceptance_criteria": [
    {
      "id": "AC-ADSMANAGER-001",
      "scenario": "Config ads.type 'ima' inicializa IMA",
      "given": "Player con config ads.type: 'ima' y ads.map con URL VAST válida",
      "when": "El player inicializa",
      "then": "El sistema IMA se inicializa. Los eventos IMA lifecycle se emiten. El sistema DAI NO es inicializado.",
      "priority": "MUST",
      "covered_by": ["tests/e2e/ads-ima-tag-params.spec.ts"]
    },
    {
      "id": "AC-ADSMANAGER-002",
      "scenario": "VAST 3.0 con Wrapper chain resuelto correctamente",
      "given": "ads.map apuntando a VAST Wrapper que apunta a 2 Wrappers anidados con el creativo final",
      "when": "El player carga los ads",
      "then": "La cadena de Wrappers se resuelve. El creativo final se reproduce. Los beacons de tracking de cada Wrapper se disparan.",
      "priority": "MUST",
      "covered_by": []
    },
    {
      "id": "AC-ADSMANAGER-003",
      "scenario": "Ad system no disponible → graceful degradation",
      "given": "Player con ads configurados pero el SDK del ad system no carga",
      "when": "El player intenta inicializar ads",
      "then": "Content reproduce normalmente sin ads. No se emite error fatal. adsError puede emitirse pero no bloquea.",
      "priority": "MUST",
      "covered_by": []
    },
    {
      "id": "AC-ADSMANAGER-004",
      "scenario": "ads.map null → sin ads",
      "given": "Player con ads.map = null o ads no configurados",
      "when": "El player inicializa",
      "then": "No se inicializa ningún ad system. Content reproduce inmediatamente. adsRequested no se emite.",
      "priority": "MUST",
      "covered_by": ["tests/e2e/vod-playback.spec.ts"]
    },
    {
      "id": "AC-ADSMANAGER-005",
      "scenario": "VMAP con mid-roll insertado en timestamp correcto",
      "given": "ads.map apuntando a VMAP con mid-roll en t=00:01:00",
      "when": "El content alcanza el minuto 1",
      "then": "La reproducción se pausa en el minuto 1. El ad break se reproduce. Content reanuda desde t=00:01:00.",
      "priority": "SHOULD",
      "covered_by": []
    },
    {
      "id": "AC-ADSMANAGER-006",
      "scenario": "reset() al cargar nuevo content",
      "given": "Player que reprodujo un content con ads y llama load() con nuevo content",
      "when": "El nuevo content comienza a cargar",
      "then": "El estado de ads es reseteado. Los cue points del content anterior no interfieren con el nuevo content.",
      "priority": "SHOULD",
      "covered_by": []
    }
  ],
  "known_bugs": [],
  "do_not_reflag": [],
  "test_anti_patterns": [
    "No mockear VAST XML localmente — usar mock-vast/server.ts del proyecto",
    "No testear VPAID en CI — el sandbox de Playwright no soporta VPAID",
    "No asumir que ads.type está siempre presente — puede inferirse del config de plataforma"
  ]
}
