{
  "schema_version": "1.0",
  "module": "events",
  "status": "curated",
  "last_verified": "2026-06-05",
  "events": [
    {
      "name": "* (todos los eventos en Events.*)",
      "when": "Cualquier módulo llama internalEmitter.emit(eventName, payload)",
      "payload_shape": { "varies": "por evento" },
      "optional": false
    }
  ],
  "api_contracts": [
    {
      "method": "player.on(event, handler)",
      "signature": "on(event: string, handler: Function): void",
      "expected_behavior": "Registra handler en ExternalEmitter. Solo eventos en Events.* son aceptados. Eventos inválidos ignorados silenciosamente (isValidEvent check).",
      "side_effects": ["internalEmitter.on(event, handler) registrado"],
      "error_behavior": "No arroja error. Silenciosamente no registra si event no está en Events.*"
    },
    {
      "method": "player.once(event, handler)",
      "signature": "once(event: string, handler: Function): void",
      "expected_behavior": "Igual que on() pero el handler se ejecuta solo una vez y se auto-elimina.",
      "side_effects": ["internalEmitter.once(event, handler) registrado"],
      "error_behavior": "No arroja error. Silenciosamente no registra si event no está en Events.*"
    },
    {
      "method": "player.off(event, handler)",
      "signature": "off(event: string, handler: Function): void",
      "expected_behavior": "Elimina handler registrado para el evento dado.",
      "side_effects": ["internalEmitter.off(event, handler) ejecutado"],
      "error_behavior": "No arroja error. No-op si el handler no estaba registrado."
    },
    {
      "method": "internalEmitter.emit(event, ...args)",
      "signature": "emit(event: string, ...args: any[]): void",
      "expected_behavior": "Emite evento internamente Y vía window.postMessage con prefijo msp:. Eventos msp: no se re-emiten vía postMessage (evita loop).",
      "side_effects": [
        "window.postMessage({ event: 'msp:' + event, id: uniqueId }, location.origin)",
        "Todos los handlers registrados con on(event) son ejecutados"
      ],
      "error_behavior": "Si disableMspEvents=true, solo emite internamente. No arroja error."
    },
    {
      "method": "internalEmitter.reset()",
      "signature": "reset(): void",
      "expected_behavior": "Elimina todos los listeners del emitter. Usado en destroy().",
      "side_effects": ["removeAllListeners() ejecutado"],
      "error_behavior": "No arroja error."
    }
  ],
  "acceptance_criteria": [
    {
      "id": "AC-EVENTS-001",
      "scenario": "Todos los eventos en Events.* son escuchables",
      "given": "Player inicializado",
      "when": "Se registra player.on(eventName, fn) para cada evento en Events.*",
      "then": "El handler fn es llamado cuando el evento se emite. No hay ningún evento en Events.* que sea ignorado silenciosamente.",
      "priority": "MUST",
      "covered_by": ["tests/contract/"]
    },
    {
      "id": "AC-EVENTS-002",
      "scenario": "Renombrar constante en Events rompe listeners",
      "given": "Un test usa player.on('ready', fn)",
      "when": "El valor de Events._ready cambia de 'ready' a otro string",
      "then": "El test de contrato detecta la rotura. AC que valida que Events._ready === 'ready' falla.",
      "priority": "MUST",
      "covered_by": ["tests/contract/"]
    },
    {
      "id": "AC-EVENTS-003",
      "scenario": "postMessage emite mismo evento que internalEmitter",
      "given": "Dos instancias del player en la misma página",
      "when": "Una instancia emite 'playing'",
      "then": "La otra instancia recibe el evento vía postMessage con prefijo msp:. La instancia que emitió NO recibe su propio postMessage (filtro por uniqueId).",
      "priority": "MUST",
      "covered_by": []
    },
    {
      "id": "AC-EVENTS-004",
      "scenario": "Evento inválido ignorado silenciosamente",
      "given": "Player inicializado",
      "when": "Se llama player.on('eventoQueNoExiste', fn)",
      "then": "No se registra ningún listener. No se arroja error. fn nunca es llamada.",
      "priority": "SHOULD",
      "covered_by": ["tests/contract/"]
    },
    {
      "id": "AC-EVENTS-005",
      "scenario": "postMessage de origen diferente ignorado",
      "given": "Player inicializado",
      "when": "Se envía window.postMessage desde un origen diferente a location.origin",
      "then": "El mensaje es ignorado. No se emite ningún evento interno.",
      "priority": "SHOULD",
      "covered_by": []
    },
    {
      "id": "AC-EVENTS-006",
      "scenario": "player.off elimina listener correctamente",
      "given": "player.on('ready', fn) registrado",
      "when": "Se llama player.off('ready', fn) y luego se emite 'ready'",
      "then": "fn NO es llamada. No hay error.",
      "priority": "SHOULD",
      "covered_by": []
    }
  ],
  "known_bugs": [],
  "do_not_reflag": [],
  "test_anti_patterns": [
    "No usar window.postMessage directamente en tests — usar player.on()",
    "No acceder a internalEmitter desde tests — es interno",
    "No asumir que un evento inválido arroja error — es silencioso"
  ]
}
