{
  "schema_version": "1.0",
  "module": "state",
  "status": "curated",
  "last_verified": "2026-06-05",
  "events": [],
  "api_contracts": [
    {
      "method": "setData(key, value)",
      "expected_behavior": "Actualiza el estado del contexto React. Propaga el cambio a todos los consumidores del contexto (via Jotai atoms). Los cambios son async — usar expect.poll() en tests.",
      "side_effects": ["Todos los componentes que consumen el atom re-renderizan"],
      "error_behavior": "Key desconocido → ignorado silenciosamente."
    }
  ],
  "acceptance_criteria": [
    {
      "id": "AC-STATE-001",
      "scenario": "player.paused refleja estado real después de play()/pause()",
      "given": "Player reproduciendo contenido",
      "when": "Se llama player.pause() y luego player.play()",
      "then": "player.paused === true después de pause(). player.paused === false después de play(). Verificar con expect.poll() por la naturaleza async de Jotai.",
      "priority": "MUST",
      "covered_by": ["tests/e2e/vod-playback.spec.ts"]
    },
    {
      "id": "AC-STATE-002",
      "scenario": "Estado reseteado al cargar nuevo content",
      "given": "Player que reprodujo un VOD completo (ended)",
      "when": "Se llama player.load() con nuevo content",
      "then": "player.currentTime === 0. player.paused === true. player.duration refleja el nuevo content.",
      "priority": "SHOULD",
      "covered_by": []
    }
  ],
  "known_bugs": [],
  "do_not_reflag": [],
  "test_anti_patterns": [
    "No usar expect() directo en propiedades de estado — usar expect.poll() por la naturaleza async de Jotai",
    "No acceder a atoms Jotai directamente desde tests — usar la API pública"
  ]
}
