{
  "schema_version": "1.0",
  "module": "api-bootstrap",
  "status": "curated",
  "last_verified": "2026-06-05",
  "events": [
    {
      "name": "playerloaded",
      "when": "Player totalmente inicializado y listo. Disparado en el script tag como CustomEvent.",
      "payload_shape": { "detail": "PlayerInstance" },
      "must_follow": ["ready"]
    },
    {
      "name": "error",
      "when": "Error fatal durante carga de config de plataforma (404, red, etc.)",
      "payload_shape": { "fatal": "true", "message": "string" },
      "optional": true
    }
  ],
  "api_contracts": [
    {
      "method": "Script tag embed",
      "signature": "<script src='api.js' data-type='media' data-id='ABC123' ...></script>",
      "expected_behavior": "Al cargar el script, se parsean los data-* attributes, se carga la config de plataforma, se monta el player en el DOM. Dispara playerloaded en el script tag.",
      "side_effects": ["DOM player element creado", "playerloaded CustomEvent disparado"],
      "error_behavior": "Si id no existe (404 en plataforma), emite error event con fatal:true. No hace loop de retries."
    },
    {
      "method": "loadMSPlayer(container, options)",
      "signature": "loadMSPlayer(container: string|HTMLElement, options?: PlayerConfig): Promise<PlayerAPI>",
      "expected_behavior": "Monta el player en el container indicado. Si ya hay una instancia, la destruye primero. Retorna Promise que resuelve con la API del player.",
      "side_effects": ["Instancia anterior destruida si existe", "Nueva instancia montada"],
      "error_behavior": "Si container no existe, Promise rejected con error descriptivo."
    },
    {
      "method": "data-* attribute parsing",
      "signature": "data-type, data-id, data-autoplay, data-ads-map, data-custom-*, ...",
      "expected_behavior": "Atributos data-* se convierten a camelCase. data-custom-* se agrupan en config.custom. Valores con $ se evalúan como expresiones JS.",
      "side_effects": [],
      "error_behavior": "Atributo inválido ignorado silenciosamente."
    },
    {
      "method": "destroy()",
      "signature": "destroy(): void",
      "expected_behavior": "Elimina el elemento DOM del player, libera recursos. Segunda llamada a loadMSPlayer() la invoca automáticamente.",
      "side_effects": ["DOM element eliminado"],
      "error_behavior": "No-op si ya destruido."
    }
  ],
  "acceptance_criteria": [
    {
      "id": "AC-BOOTSTRAP-001",
      "scenario": "Embed via script tag con data-id válido",
      "given": "Script tag con data-type='media', data-id válido, data-player válido",
      "when": "El script se carga en el browser",
      "then": "El player se monta en el DOM. Se emite evento 'ready'. Se dispara 'playerloaded' en el script tag con la instancia del player.",
      "priority": "MUST",
      "covered_by": ["tests/e2e/vod-playback.spec.ts"]
    },
    {
      "id": "AC-BOOTSTRAP-002",
      "scenario": "loadMSPlayer() retorna instancia con API",
      "given": "Script tag sin data-id (modo loadMSPlayer)",
      "when": "Se llama window.loadMSPlayer('container-id', { type: 'media', id: 'ABC' })",
      "then": "Promise resuelve con objeto player que tiene métodos on, play, pause, destroy.",
      "priority": "MUST",
      "covered_by": ["tests/e2e/vod-playback.spec.ts", "tests/contract/"]
    },
    {
      "id": "AC-BOOTSTRAP-003",
      "scenario": "data-id inválido → error, no retry loop",
      "given": "Script tag con data-id que no existe en la plataforma (404)",
      "when": "El script intenta cargar la config",
      "then": "Se emite evento 'error' con fatal:true. No hay loop de retries infinito. El player queda en estado de error sin crashear.",
      "priority": "MUST",
      "covered_by": ["tests/contract/api-bootstrap.spec.ts"]
    },
    {
      "id": "AC-BOOTSTRAP-004",
      "scenario": "data-custom-* preservados en config",
      "given": "Script tag con data-custom-myvar='valor'",
      "when": "El player se inicializa",
      "then": "config.custom.myvar === 'valor'. El valor está disponible para plugins y analytics.",
      "priority": "SHOULD",
      "covered_by": []
    },
    {
      "id": "AC-BOOTSTRAP-005",
      "scenario": "Segunda instancia loadMSPlayer destruye la primera",
      "given": "Una instancia del player ya montada vía loadMSPlayer()",
      "when": "Se llama loadMSPlayer() con un nuevo container",
      "then": "La instancia anterior es destruida (DOM element eliminado). La nueva instancia se monta correctamente.",
      "priority": "SHOULD",
      "covered_by": []
    },
    {
      "id": "AC-BOOTSTRAP-006",
      "scenario": "playerloaded CustomEvent disparado en script tag",
      "given": "Embed vía script tag con data-loaded='myCallback'",
      "when": "El player termina de inicializarse",
      "then": "myCallback es invocado con la instancia del player. El evento 'playerloaded' es disparado en el script tag.",
      "priority": "MUST",
      "covered_by": ["tests/contract/api-bootstrap.spec.ts"]
    }
  ],
  "known_bugs": [],
  "do_not_reflag": [],
  "test_anti_patterns": [
    "No testear api.js directamente — testear el comportamiento desde el browser (Playwright)",
    "No mockear la plataforma en tests de bootstrap — usar fixture de contenido real"
  ]
}
